{
  "$schema": "https://json-schema.org/draft/2020-12/schema",
  "$id": "https://spec-kit-plus.local/schemas/human-acceptance-state-schema.json",
  "title": "Resumable human product acceptance state",
  "type": "object",
  "additionalProperties": false,
  "required": ["version", "schema_ref", "status", "source", "orientation", "scenarios", "cursor", "findings", "overall"],
  "properties": {
    "version": {"const": 1},
    "schema_ref": {"const": ".specify/templates/human-acceptance-state-schema.json"},
    "status": {"enum": ["draft", "ready", "in_progress", "accepted", "rejected", "blocked", "stale"]},
    "source": {
      "type": "object",
      "additionalProperties": false,
      "required": ["implementation_summary", "implementation_summary_sha256", "prepared_from_sha256", "current_sha256"],
      "properties": {
        "implementation_summary": {"const": "implementation-summary.md"},
        "implementation_summary_sha256": {"type": "string"},
        "prepared_from_sha256": {"type": "string"},
        "current_sha256": {"type": "string"}
      }
    },
    "orientation": {
      "type": "object",
      "additionalProperties": false,
      "required": ["outcome", "why_it_matters", "user_visible_changes", "not_in_scope", "prerequisites", "start_here"],
      "properties": {
        "outcome": {"type": "string"},
        "why_it_matters": {"type": "string"},
        "user_visible_changes": {"type": "array", "items": {"type": "string"}},
        "not_in_scope": {"type": "array", "items": {"type": "string"}},
        "prerequisites": {"type": "array", "items": {"type": "string"}},
        "start_here": {"type": "string"}
      }
    },
    "scenarios": {
      "type": "array",
      "items": {"$ref": "#/$defs/scenario"}
    },
    "cursor": {
      "type": "object",
      "additionalProperties": false,
      "required": ["scenario_id", "step_id"],
      "properties": {
        "scenario_id": {"type": ["string", "null"]},
        "step_id": {"type": ["string", "null"]}
      }
    },
    "findings": {
      "type": "array",
      "items": {"$ref": "#/$defs/finding"}
    },
    "overall": {
      "type": "object",
      "additionalProperties": false,
      "required": ["verdict", "summary", "next_command"],
      "properties": {
        "verdict": {"enum": ["pending", "pass", "fail", "blocked"]},
        "summary": {"type": "string"},
        "next_command": {"type": ["string", "null"]}
      }
    }
  },
  "$defs": {
    "step": {
      "type": "object",
      "additionalProperties": false,
      "required": ["id", "action", "expected_result", "if_failed", "response_prompt", "result", "observed_result", "evidence"],
      "properties": {
        "id": {"type": "string", "minLength": 1},
        "action": {"type": "string", "minLength": 1},
        "expected_result": {"type": "string", "minLength": 1},
        "if_failed": {"type": "string", "minLength": 1},
        "response_prompt": {"type": "string", "minLength": 1},
        "result": {"enum": ["pending", "pass", "fail", "blocked", "not_run"]},
        "observed_result": {"type": ["string", "null"]},
        "evidence": {"type": "array", "items": {"type": "string"}}
      }
    },
    "scenario": {
      "type": "object",
      "additionalProperties": false,
      "required": ["id", "title", "user_value", "required", "start_state", "steps", "verdict", "notes"],
      "properties": {
        "id": {"type": "string", "minLength": 1},
        "title": {"type": "string", "minLength": 1},
        "user_value": {"type": "string", "minLength": 1},
        "required": {"type": "boolean"},
        "start_state": {"type": "string", "minLength": 1},
        "steps": {"type": "array", "minItems": 1, "items": {"$ref": "#/$defs/step"}},
        "verdict": {"enum": ["pending", "pass", "fail", "blocked", "not_run"]},
        "notes": {"type": ["string", "null"]}
      }
    },
    "finding": {
      "type": "object",
      "additionalProperties": false,
      "required": ["id", "scenario_id", "step_id", "classification", "expected", "observed", "evidence", "route", "status"],
      "properties": {
        "id": {"type": "string", "minLength": 1},
        "scenario_id": {"type": "string", "minLength": 1},
        "step_id": {"type": "string", "minLength": 1},
        "classification": {"enum": ["product-defect", "requirement-gap", "environment-or-access", "unable-to-verify"]},
        "expected": {"type": "string", "minLength": 1},
        "observed": {"type": "string", "minLength": 1},
        "evidence": {"type": "array", "minItems": 1, "items": {"type": "string"}},
        "route": {"enum": ["sp-implement", "sp-debug", "sp-clarify", "sp-specify", "spx-implement", "spx-debug", "spx-clarify", "spx-specify", "human-action"]},
        "status": {"enum": ["open", "resolved"]}
      }
    }
  }
}
